{
  "$schema": "https://json-schema.org/draft/2020-12/schema",
  "$id": "https://pilot.invalid/schemas/agentcore-runtime-update-mmdsv2-input.json",
  "title": "Pilot AgentCore Runtime mandatory MMDSv2 update input",
  "description": "Account-time wrapper for the mandatory post-create UpdateAgentRuntime operation. agentRuntimeId is the URI parameter; updateInput is the request body.",
  "type": "object",
  "additionalProperties": false,
  "required": ["region", "destinationAccountId", "agentRuntimeId", "updateInput"],
  "properties": {
    "region": { "enum": ["us-east-1", "us-east-2"] },
    "destinationAccountId": { "type": "string", "pattern": "^[0-9]{12}$" },
    "agentRuntimeId": {
      "type": "string",
      "pattern": "^[A-Za-z][A-Za-z0-9_]{0,99}-[A-Za-z0-9]{10}$"
    },
    "updateInput": {
      "type": "object",
      "additionalProperties": false,
      "required": ["agentRuntimeArtifact", "roleArn", "authorizerConfiguration", "protocolConfiguration", "networkConfiguration", "environmentVariables", "metadataConfiguration"],
      "properties": {
        "agentRuntimeArtifact": {
          "type": "object",
          "additionalProperties": false,
          "required": ["containerConfiguration"],
          "properties": {
            "containerConfiguration": {
              "type": "object",
              "additionalProperties": false,
              "required": ["containerUri"],
              "properties": {
                "containerUri": {
                  "type": "string",
                  "pattern": "^[0-9]{12}\\.dkr\\.ecr\\.(?:us-east-1|us-east-2)\\.amazonaws\\.com/[a-z0-9]+(?:[._/-][a-z0-9]+)*@sha256:[a-f0-9]{64}$"
                }
              }
            }
          }
        },
        "roleArn": {
          "type": "string",
          "pattern": "^arn:aws:iam::[0-9]{12}:role/.+$"
        },
        "authorizerConfiguration": {
          "type": "object",
          "additionalProperties": false,
          "required": ["customJWTAuthorizer"],
          "properties": {
            "customJWTAuthorizer": {
              "type": "object",
              "additionalProperties": false,
              "required": ["discoveryUrl", "allowedAudience", "allowedClients", "allowedScopes", "customClaims"],
              "properties": {
                "discoveryUrl": {
                  "type": "string",
                  "maxLength": 2048,
                  "pattern": "^https://[^/?#]+(?:/[^?#]*)?/\\.well-known/openid-configuration$"
                },
                "allowedAudience": {
                  "type": "array",
                  "minItems": 1,
                  "maxItems": 1,
                  "uniqueItems": true,
                  "items": { "type": "string", "minLength": 1, "maxLength": 255, "pattern": "^[A-Za-z0-9_.:/-]+$" }
                },
                "allowedClients": {
                  "type": "array",
                  "minItems": 1,
                  "maxItems": 1,
                  "uniqueItems": true,
                  "items": { "type": "string", "minLength": 1, "maxLength": 255, "pattern": "^[A-Za-z0-9_.:/-]+$" }
                },
                "allowedScopes": {
                  "type": "array",
                  "minItems": 1,
                  "maxItems": 1,
                  "uniqueItems": true,
                  "items": { "const": "pilot.invoke_agentcore_research" }
                },
                "customClaims": {
                  "type": "array",
                  "minItems": 2,
                  "maxItems": 2,
                  "items": {
                    "type": "object",
                    "additionalProperties": false,
                    "required": ["inboundTokenClaimName", "inboundTokenClaimValueType", "authorizingClaimMatchValue"],
                    "properties": {
                      "inboundTokenClaimName": { "type": "string", "minLength": 1, "maxLength": 255, "pattern": "^[A-Za-z0-9_.:-]+$" },
                      "inboundTokenClaimValueType": { "const": "STRING" },
                      "authorizingClaimMatchValue": {
                        "type": "object",
                        "additionalProperties": false,
                        "required": ["claimMatchOperator", "claimMatchValue"],
                        "properties": {
                          "claimMatchOperator": { "const": "EQUALS" },
                          "claimMatchValue": {
                            "type": "object",
                            "additionalProperties": false,
                            "required": ["matchValueString"],
                            "properties": {
                              "matchValueString": { "type": "string", "minLength": 1, "maxLength": 255, "pattern": "^[A-Za-z0-9_.-]+$" }
                            }
                          }
                        }
                      }
                    }
                  }
                }
              }
            }
          }
        },
        "protocolConfiguration": {
          "type": "object",
          "additionalProperties": false,
          "required": ["serverProtocol"],
          "properties": { "serverProtocol": { "const": "HTTP" } }
        },
        "networkConfiguration": {
          "type": "object",
          "additionalProperties": false,
          "required": ["networkMode"],
          "properties": { "networkMode": { "enum": ["PUBLIC", "VPC"] } }
        },
        "environmentVariables": {
          "type": "object",
          "additionalProperties": false,
          "required": [
            "AGENTCORE_RUNTIME_SERVER_MODE",
            "AGENTCORE_AWS_REGION",
            "AGENTCORE_IDENTITY_CREDENTIAL_PROVIDER_NAME",
            "AGENTCORE_GATEWAY_URL",
            "AGENTCORE_GATEWAY_TOOL_NAME",
            "AGENTCORE_GATEWAY_JWT_ISSUER",
            "AGENTCORE_GATEWAY_JWT_JWKS_URL",
            "AGENTCORE_GATEWAY_JWT_AUDIENCES_JSON",
            "AGENTCORE_GATEWAY_JWT_ALLOWED_SUBJECTS_JSON",
            "AGENTCORE_GATEWAY_JWT_ALLOWED_CLIENTS_JSON",
            "AGENTCORE_GATEWAY_JWT_REQUIRED_SCOPES_JSON",
            "AGENTCORE_GATEWAY_JWT_CLIENT_CLAIM",
            "AGENTCORE_GATEWAY_JWT_TENANT_CLAIM",
            "AGENTCORE_GATEWAY_JWT_DEPLOYMENT_TENANT_ID",
            "AGENTCORE_GATEWAY_JWT_ALGORITHMS_JSON",
            "AGENTCORE_GATEWAY_JWT_CLOCK_TOLERANCE_SECONDS",
            "AGENTCORE_GATEWAY_JWT_MAX_TOKEN_AGE_SECONDS",
            "AGENTCORE_GATEWAY_JWT_MAX_TOKEN_LIFETIME_SECONDS",
            "AGENTCORE_GATEWAY_JWT_JWKS_CACHE_TTL_MS",
            "AGENTCORE_GATEWAY_JWT_JWKS_REFRESH_COOLDOWN_MS",
            "AGENTCORE_GATEWAY_JWT_REVOCATION_MODE",
            "AGENTCORE_REPLAY_TABLE",
            "AGENTCORE_REPLAY_DEPLOYMENT_ID",
            "AGENTCORE_REPLAY_LEASE_MS",
            "AGENTCORE_REPLAY_RETENTION_MS",
            "AGENTCORE_RUNTIME_REQUEST_TIMEOUT_MS",
            "AGENTCORE_RUNTIME_MAX_REQUEST_BYTES",
            "AGENTCORE_RUNTIME_MAX_RESPONSE_BYTES",
            "AGENTCORE_RUNTIME_MAX_CONCURRENT_REQUESTS"
          ],
          "properties": {
            "AGENTCORE_RUNTIME_SERVER_MODE": { "const": "aws" },
            "AGENTCORE_AWS_REGION": { "enum": ["us-east-1", "us-east-2"] },
            "AGENTCORE_IDENTITY_CREDENTIAL_PROVIDER_NAME": { "type": "string", "pattern": "^[A-Za-z0-9][A-Za-z0-9_.-]{0,127}$" },
            "AGENTCORE_GATEWAY_URL": { "type": "string", "pattern": "^https://[0-9a-z](?:[0-9a-z-]{0,98}[0-9a-z])?-[0-9a-z]{10}\\.gateway\\.bedrock-agentcore\\.(?:us-east-1|us-east-2)\\.amazonaws\\.com/mcp$" },
            "AGENTCORE_GATEWAY_TOOL_NAME": { "type": "string", "pattern": "^[A-Za-z0-9_-]+___pilot\\.read_market_context$" },
            "AGENTCORE_GATEWAY_JWT_ISSUER": { "type": "string", "pattern": "^https://[^?#]+$" },
            "AGENTCORE_GATEWAY_JWT_JWKS_URL": { "type": "string", "pattern": "^https://[^?#]+$" },
            "AGENTCORE_GATEWAY_JWT_AUDIENCES_JSON": { "type": "string", "minLength": 3, "maxLength": 8192 },
            "AGENTCORE_GATEWAY_JWT_ALLOWED_SUBJECTS_JSON": { "type": "string", "minLength": 3, "maxLength": 8192 },
            "AGENTCORE_GATEWAY_JWT_ALLOWED_CLIENTS_JSON": { "type": "string", "minLength": 3, "maxLength": 8192 },
            "AGENTCORE_GATEWAY_JWT_REQUIRED_SCOPES_JSON": { "type": "string", "minLength": 3, "maxLength": 8192 },
            "AGENTCORE_GATEWAY_JWT_CLIENT_CLAIM": { "const": "client_id" },
            "AGENTCORE_GATEWAY_JWT_TENANT_CLAIM": { "type": "string", "pattern": "^[A-Za-z][A-Za-z0-9_.:-]{0,127}$" },
            "AGENTCORE_GATEWAY_JWT_DEPLOYMENT_TENANT_ID": { "type": "string", "pattern": "^[A-Za-z0-9_.:/-]{1,255}$" },
            "AGENTCORE_GATEWAY_JWT_ALGORITHMS_JSON": { "enum": ["[\"RS256\"]", "[\"ES256\"]", "[\"RS256\",\"ES256\"]", "[\"ES256\",\"RS256\"]"] },
            "AGENTCORE_GATEWAY_JWT_CLOCK_TOLERANCE_SECONDS": { "type": "string", "pattern": "^(?:[0-9]|[1-5][0-9]|60)$" },
            "AGENTCORE_GATEWAY_JWT_MAX_TOKEN_AGE_SECONDS": { "type": "string", "pattern": "^(?:[3-9][0-9]|[1-9][0-9]{2}|[1-2][0-9]{3}|3[0-5][0-9]{2}|3600)$" },
            "AGENTCORE_GATEWAY_JWT_MAX_TOKEN_LIFETIME_SECONDS": { "type": "string", "pattern": "^(?:[3-9][0-9]|[1-9][0-9]{2}|[1-2][0-9]{3}|3[0-5][0-9]{2}|3600)$" },
            "AGENTCORE_GATEWAY_JWT_JWKS_CACHE_TTL_MS": { "type": "string", "pattern": "^[0-9]{4,6}$" },
            "AGENTCORE_GATEWAY_JWT_JWKS_REFRESH_COOLDOWN_MS": { "type": "string", "pattern": "^[0-9]{4,5}$" },
            "AGENTCORE_GATEWAY_JWT_REVOCATION_MODE": { "const": "expiry_only" },
            "AGENTCORE_REPLAY_TABLE": { "type": "string", "pattern": "^[A-Za-z0-9_.-]{3,255}$" },
            "AGENTCORE_REPLAY_DEPLOYMENT_ID": { "type": "string", "pattern": "^[A-Za-z0-9][A-Za-z0-9._:-]{2,127}$" },
            "AGENTCORE_REPLAY_LEASE_MS": { "type": "string", "pattern": "^[0-9]{4,6}$" },
            "AGENTCORE_REPLAY_RETENTION_MS": { "type": "string", "pattern": "^[0-9]{5,8}$" },
            "AGENTCORE_RUNTIME_REQUEST_TIMEOUT_MS": { "type": "string", "pattern": "^[0-9]{3,5}$" },
            "AGENTCORE_RUNTIME_MAX_REQUEST_BYTES": { "type": "string", "pattern": "^[0-9]{4,7}$" },
            "AGENTCORE_RUNTIME_MAX_RESPONSE_BYTES": { "type": "string", "pattern": "^[0-9]{4,7}$" },
            "AGENTCORE_RUNTIME_MAX_CONCURRENT_REQUESTS": { "type": "string", "pattern": "^[0-9]{1,2}$" }
          }
        },
        "metadataConfiguration": {
          "type": "object",
          "additionalProperties": false,
          "required": ["requireMMDSV2"],
          "properties": { "requireMMDSV2": { "const": true } }
        }
      }
    }
  }
}
