{
  "region": "us-east-2",
  "destinationAccountId": "000000000000",
  "agentRuntimeId": "PilotResearchRuntime-0000000000",
  "updateInput": {
    "agentRuntimeArtifact": {
      "containerConfiguration": {
        "containerUri": "000000000000.dkr.ecr.us-east-2.amazonaws.com/pilot-agentcore@sha256:0000000000000000000000000000000000000000000000000000000000000000"
      }
    },
    "roleArn": "arn:aws:iam::000000000000:role/pilot-agentcore-runtime-example",
    "authorizerConfiguration": {
      "customJWTAuthorizer": {
        "discoveryUrl": "https://identity.example.invalid/.well-known/openid-configuration",
        "allowedAudience": ["pilot-agentcore-runtime"],
        "allowedClients": ["pilot-agentcore-server"],
        "allowedScopes": ["pilot.invoke_agentcore_research"],
        "customClaims": [
          {
            "inboundTokenClaimName": "sub",
            "inboundTokenClaimValueType": "STRING",
            "authorizingClaimMatchValue": {
              "claimMatchOperator": "EQUALS",
              "claimMatchValue": { "matchValueString": "pilot-server" }
            }
          },
          {
            "inboundTokenClaimName": "tenant_id",
            "inboundTokenClaimValueType": "STRING",
            "authorizingClaimMatchValue": {
              "claimMatchOperator": "EQUALS",
              "claimMatchValue": { "matchValueString": "pilot-agentcore-event-workload" }
            }
          }
        ]
      }
    },
    "protocolConfiguration": {
      "serverProtocol": "HTTP"
    },
    "networkConfiguration": {
      "networkMode": "PUBLIC"
    },
    "environmentVariables": {
      "AGENTCORE_RUNTIME_SERVER_MODE": "aws",
      "AGENTCORE_AWS_REGION": "us-east-2",
      "AGENTCORE_IDENTITY_CREDENTIAL_PROVIDER_NAME": "pilot-agentcore-gateway-oauth",
      "AGENTCORE_GATEWAY_URL": "https://pilotgateway-0000000000.gateway.bedrock-agentcore.us-east-2.amazonaws.com/mcp",
      "AGENTCORE_GATEWAY_TOOL_NAME": "PilotReadTarget___pilot.read_market_context",
      "AGENTCORE_GATEWAY_JWT_ISSUER": "https://identity.example.invalid/",
      "AGENTCORE_GATEWAY_JWT_JWKS_URL": "https://identity.example.invalid/.well-known/jwks.json",
      "AGENTCORE_GATEWAY_JWT_AUDIENCES_JSON": "[\"pilot-agentcore-gateway\"]",
      "AGENTCORE_GATEWAY_JWT_ALLOWED_SUBJECTS_JSON": "[\"pilot-runtime\"]",
      "AGENTCORE_GATEWAY_JWT_ALLOWED_CLIENTS_JSON": "[\"pilot-agentcore-runtime\"]",
      "AGENTCORE_GATEWAY_JWT_REQUIRED_SCOPES_JSON": "[\"pilot.read_market_context\"]",
      "AGENTCORE_GATEWAY_JWT_CLIENT_CLAIM": "client_id",
      "AGENTCORE_GATEWAY_JWT_TENANT_CLAIM": "tenant_id",
      "AGENTCORE_GATEWAY_JWT_DEPLOYMENT_TENANT_ID": "pilot-agentcore-event-workload",
      "AGENTCORE_GATEWAY_JWT_ALGORITHMS_JSON": "[\"RS256\"]",
      "AGENTCORE_GATEWAY_JWT_CLOCK_TOLERANCE_SECONDS": "30",
      "AGENTCORE_GATEWAY_JWT_MAX_TOKEN_AGE_SECONDS": "300",
      "AGENTCORE_GATEWAY_JWT_MAX_TOKEN_LIFETIME_SECONDS": "600",
      "AGENTCORE_GATEWAY_JWT_JWKS_CACHE_TTL_MS": "300000",
      "AGENTCORE_GATEWAY_JWT_JWKS_REFRESH_COOLDOWN_MS": "10000",
      "AGENTCORE_GATEWAY_JWT_REVOCATION_MODE": "expiry_only",
      "AGENTCORE_REPLAY_TABLE": "pilot-agentcore-replay-example",
      "AGENTCORE_REPLAY_DEPLOYMENT_ID": "pilot-agentcore-event-workload",
      "AGENTCORE_REPLAY_LEASE_MS": "30000",
      "AGENTCORE_REPLAY_RETENTION_MS": "86400000",
      "AGENTCORE_RUNTIME_REQUEST_TIMEOUT_MS": "30000",
      "AGENTCORE_RUNTIME_MAX_REQUEST_BYTES": "65536",
      "AGENTCORE_RUNTIME_MAX_RESPONSE_BYTES": "262144",
      "AGENTCORE_RUNTIME_MAX_CONCURRENT_REQUESTS": "1"
    },
    "metadataConfiguration": {
      "requireMMDSV2": true
    }
  }
}
